[
  {
    "id": "SITE-001",
    "name": "团地边缘空地",
    "name_ja": "団地縁辺空地",
    "name_en": "Design topic: 团地边缘空地",
    "address_example": "东京都板桥区｜高岛平团地与高岛平地域",
    "address_example_ja": "東京都板橋区｜高島平団地・高島平地域",
    "address_example_en": "Tokyo Itabashi | Takashimadaira Danchi area",
    "fit_reason": "住户高龄化明显且公共空间常被低效使用，适合植入照护、共食、育儿和小商业混合节点。",
    "fit_reason_ja": "団地縁辺空地は、団地・高齢・公共空間・ケアを空間化しやすい敷地タイプ。周辺の既存資源、日常利用、公共性を読み取り、卒業設計の候補地として比較できる。",
    "fit_reason_en": "Design topic: 团地边缘空地 is a site type that can turn Design topic: 团地, aging, publicspace, care into a spatial proposal. It helps compare existing resources, daily use, and publicness for a thesis project.",
    "map_url": "",
    "keywords": [
      "团地",
      "高龄",
      "公共空间",
      "照护",
      "共食",
      "老龄化"
    ],
    "keywords_ja": [
      "団地",
      "高齢",
      "公共空間",
      "ケア",
      "共食",
      "高齢化"
    ],
    "keywords_en": [
      "Design topic: 团地",
      "aging",
      "publicspace",
      "care",
      "shared meals"
    ],
    "candidate_locations": [
      {
        "area": "东京都板桥区",
        "area_ja": "東京都板橋区",
        "area_en": "Tokyo Itabashi",
        "name": "高岛平团地与高岛平地域",
        "name_ja": "高島平団地・高島平地域",
        "name_en": "Takashimadaira Danchi area",
        "angle": "大型团地、户外公共空间和社区营造据点集中，适合调研高龄者看护与共食。",
        "angle_ja": "大型団地、屋外空間、まちづくり拠点を合わせて、高齢者の見守りと共食を調査しやすい。",
        "angle_en": "Large housing estate, open space, and community planning bases make it suitable for aging-care research.",
        "source_url": "https://www.ur-net.go.jp/chintai/kanto/tokyo/20_2250.html"
      },
      {
        "area": "东京都北区",
        "area_ja": "東京都北区",
        "area_en": "Tokyo Kita",
        "name": "赤羽台团地再生周边",
        "name_ja": "ヌーヴェル赤羽台周辺",
        "name_en": "Nouvelle Akabanedai area",
        "angle": "可观察团地更新与生活服务之间的关系，把低层和空地转化为地域照护节点。",
        "angle_ja": "団地再生と生活サービスの関係を読み、低層部や余白を地域ケアへ展開できる。",
        "angle_en": "Useful for studying how estate renewal can connect ground floors and open space to care services.",
        "source_url": "https://note.ur-net.go.jp/n/n232ec2b13763?hl=en"
      }
    ],
    "status": "published"
  },
  {
    "id": "SITE-002",
    "name": "商店街空铺",
    "name_ja": "商店街空き店舗",
    "name_en": "Design topic: 商店街空铺",
    "address_example": "东京都世田谷区｜下北泽 BONUS TRACK",
    "address_example_ja": "東京都世田谷区｜BONUS TRACK 下北沢",
    "address_example_en": "Tokyo Setagaya | BONUS TRACK Shimokitazawa",
    "fit_reason": "仍有步行人流和生活记忆，空铺尺度适中，适合社区厨房、咨询站与小型公共客厅。",
    "fit_reason_ja": "商店街空き店舗は、商店街・歩行・更新・公共リビングを空間化しやすい敷地タイプ。周辺の既存資源、日常利用、公共性を読み取り、卒業設計の候補地として比較できる。",
    "fit_reason_en": "Design topic: 商店街空铺 is a site type that can turn Design topic: 商店街, Design topic: 步行, renewal, public living room into a spatial proposal. It helps compare existing resources, daily use, and publicness for a thesis project.",
    "map_url": "",
    "keywords": [
      "商店街",
      "步行",
      "更新",
      "公共客厅",
      "社区厨房",
      "咨询",
      "公共性"
    ],
    "keywords_ja": [
      "商店街",
      "歩行",
      "更新",
      "公共リビング",
      "コミュニティキッチン",
      "相談",
      "公共性"
    ],
    "keywords_en": [
      "Design topic: 商店街",
      "Design topic: 步行",
      "renewal",
      "public living room",
      "communitykitchen",
      "consultation",
      "publicness"
    ],
    "candidate_locations": [
      {
        "area": "东京都世田谷区",
        "area_ja": "東京都世田谷区",
        "area_en": "Tokyo Setagaya",
        "name": "下北泽 BONUS TRACK",
        "name_ja": "BONUS TRACK 下北沢",
        "name_en": "BONUS TRACK Shimokitazawa",
        "angle": "小店铺、步行路径和停留空间混合，适合研究商店街尺度的公共客厅。",
        "angle_ja": "小店舗、歩行路、滞在が混ざるため、商店街の小さな公共性を読みやすい。",
        "angle_en": "Small shops, walkways, and stay spaces help study publicness at shopping-street scale.",
        "source_url": "https://tbma.jp/en/works/bonus-track/"
      },
      {
        "area": "东京都世田谷区",
        "area_ja": "東京都世田谷区",
        "area_en": "Tokyo Setagaya",
        "name": "下北泽 MIKAN SHIMOKITA",
        "name_ja": "MIKAN SHIMOKITA",
        "name_en": "MIKAN SHIMOKITA",
        "angle": "可把高架下店铺群作为通行、餐饮、工作与活动重叠的街区来比较。",
        "angle_ja": "高架下の店舗群を、通過、飲食、仕事、イベントが重なる街区として比較できる。",
        "angle_en": "A rail-adjacent retail cluster for comparing passage, food, work, and event uses.",
        "source_url": "https://tjda.com/en/projects/mikan-shimokita"
      }
    ],
    "status": "published"
  },
  {
    "id": "SITE-003",
    "name": "空屋住宅群",
    "name_ja": "空き家住宅群",
    "name_en": "Design topic: vacant house住宅群",
    "address_example": "广岛县尾道市｜尾道空屋再生项目周边",
    "address_example_ja": "広島県尾道市｜尾道空き家再生プロジェクト周辺",
    "address_example_en": "Onomichi Hiroshima | Onomichi Akiya Saisei area",
    "fit_reason": "旧住宅可低成本改造，适合共居、短住、日间照护和地方交流型题目。",
    "fit_reason_ja": "空き家住宅群は、空き家・再生・住宅・短期滞在を空間化しやすい敷地タイプ。周辺の既存資源、日常利用、公共性を読み取り、卒業設計の候補地として比較できる。",
    "fit_reason_en": "Design topic: vacant house住宅群 is a site type that can turn vacant house, regeneration, Design topic: 住宅, Design topic: 短住 into a spatial proposal. It helps compare existing resources, daily use, and publicness for a thesis project.",
    "map_url": "",
    "keywords": [
      "空屋",
      "再生",
      "住宅",
      "短住",
      "地方创生"
    ],
    "keywords_ja": [
      "空き家",
      "再生",
      "住宅",
      "短期滞在",
      "地域創生"
    ],
    "keywords_en": [
      "vacant house",
      "regeneration",
      "Design topic: 住宅",
      "Design topic: 短住",
      "local revitalization"
    ],
    "candidate_locations": [
      {
        "area": "广岛县尾道市",
        "area_ja": "広島県尾道市",
        "area_en": "Onomichi Hiroshima",
        "name": "尾道空屋再生项目周边",
        "name_ja": "尾道空き家再生プロジェクト周辺",
        "name_en": "Onomichi Akiya Saisei area",
        "angle": "坡道、空屋、短期停留和地域活动叠加，适合作为住宅再利用题目的调研入口。",
        "angle_ja": "坂道、空き家、短期滞在、地域活動が重なり、既存住宅の再利用を考えやすい。",
        "angle_en": "Slope town, vacant houses, short stay, and local activity make reuse questions tangible.",
        "source_url": "https://www.onomichisaisei.com/"
      },
      {
        "area": "京都府京都市",
        "area_ja": "京都府京都市",
        "area_en": "Kyoto City",
        "name": "京都安心住居空屋银行相关地域",
        "name_ja": "京都安心すまいバンク対象地域",
        "name_en": "Kyoto Anshin Sumai Bank areas",
        "angle": "可从町家和空屋流通支援出发，研究居住与地域利用的再编辑。",
        "angle_ja": "町家や空き家の流通支援を手がかりに、居住と地域利用の再編集を検討できる。",
        "angle_en": "A public vacant-house platform for studying housing reuse and local program insertion.",
        "source_url": "https://akiya.city.kyoto.lg.jp/ansuma-bank/"
      }
    ],
    "status": "published"
  },
  {
    "id": "SITE-004",
    "name": "车站周边缝隙地",
    "name_ja": "駅周辺隙間地",
    "name_en": "Design topic: station周边缝隙地",
    "address_example": "东京都国分寺市｜国分寺 cocobunji Plaza 周边",
    "address_example_ja": "東京都国分寺市｜cocobunjiプラザ周辺",
    "address_example_en": "Tokyo Kokubunji | cocobunji Plaza area",
    "fit_reason": "交通可达性高但空间常碎片化，适合候车、咨询、学习和夜间安全节点。",
    "fit_reason_ja": "駅周辺隙間地は、駅・隙間地・公共サービス・夜間安全を空間化しやすい敷地タイプ。周辺の既存資源、日常利用、公共性を読み取り、卒業設計の候補地として比較できる。",
    "fit_reason_en": "Design topic: station周边缝隙地 is a site type that can turn station, Design topic: 缝隙地, public service, nightsafety into a spatial proposal. It helps compare existing resources, daily use, and publicness for a thesis project.",
    "map_url": "",
    "keywords": [
      "车站",
      "缝隙地",
      "公共服务",
      "夜间安全",
      "第三空间",
      "咨询",
      "交通"
    ],
    "keywords_ja": [
      "駅",
      "隙間地",
      "公共サービス",
      "夜間安全",
      "第三空間",
      "相談",
      "交通"
    ],
    "keywords_en": [
      "station",
      "Design topic: 缝隙地",
      "public service",
      "nightsafety",
      "third place",
      "consultation",
      "transport"
    ],
    "candidate_locations": [
      {
        "area": "东京都国分寺市",
        "area_ja": "東京都国分寺市",
        "area_en": "Tokyo Kokubunji",
        "name": "国分寺 cocobunji Plaza 周边",
        "name_ja": "cocobunjiプラザ周辺",
        "name_en": "cocobunji Plaza area",
        "angle": "可参考车站前公共服务、市民活动、等待空间叠合的场地组织。",
        "angle_ja": "駅前の公共サービス、市民活動、待合を重ねる敷地読みの参考になる。",
        "angle_en": "A station-front civic hub for studying service, waiting, and community activity.",
        "source_url": "https://www.city.kokubunji.tokyo.jp/shisetsu/shikanren/hall/1017572.html"
      },
      {
        "area": "东京都港区",
        "area_ja": "東京都港区",
        "area_en": "Tokyo Minato",
        "name": "高轮Gateway站周边",
        "name_ja": "高輪ゲートウェイ駅周辺",
        "name_en": "Takanawa Gateway Station area",
        "angle": "适合观察新车站周边广场、移动和城市入口之间的关系。",
        "angle_ja": "新駅周辺の広場、移動、都市入口の関係を卒業設計の敷地条件として読める。",
        "angle_en": "Useful for reading station plazas, mobility, and an urban gateway as site conditions.",
        "source_url": "https://kkaa.co.jp/en/project/takanawa-gateway-station/"
      }
    ],
    "status": "published"
  },
  {
    "id": "SITE-005",
    "name": "废校或闲置校舍",
    "name_ja": "廃校または遊休校舍",
    "name_en": "Design topic: 废校或闲置校舍",
    "address_example": "高知县室户市｜室户废校水族馆",
    "address_example_ja": "高知県室戸市｜むろと廃校水族館",
    "address_example_en": "Muroto Kochi | Muroto Schoolhouse Aquarium",
    "fit_reason": "教室、操场和社区记忆完整，适合学习、避难、展览和多代交流复合使用。",
    "fit_reason_ja": "廃校または遊休校舍は、廃校・学習・避難・子どもを空間化しやすい敷地タイプ。周辺の既存資源、日常利用、公共性を読み取り、卒業設計の候補地として比較できる。",
    "fit_reason_en": "Design topic: 废校或闲置校舍 is a site type that can turn Design topic: 废校, learning, evacuation, children into a spatial proposal. It helps compare existing resources, daily use, and publicness for a thesis project.",
    "map_url": "",
    "keywords": [
      "废校",
      "学习",
      "避难",
      "儿童",
      "生活支持"
    ],
    "keywords_ja": [
      "廃校",
      "学習",
      "避難",
      "子ども",
      "生活支援"
    ],
    "keywords_en": [
      "Design topic: 废校",
      "learning",
      "evacuation",
      "children",
      "Design topic: 生活支持"
    ],
    "candidate_locations": [
      {
        "area": "高知县室户市",
        "area_ja": "高知県室戸市",
        "area_en": "Muroto Kochi",
        "name": "室户废校水族馆",
        "name_ja": "むろと廃校水族館",